{
  "apiVersion": "aide.dev/v1alpha1",
  "extensions": {},
  "kind": "UpdatePlan",
  "metadata": {
    "candidate_distribution_digest": "sha256:d58c533fd233e57c1a1cf6ef482a76a5a0d1158106a4f3ae8c5376b8418f0b63",
    "candidate_distribution_ref": "aide://distribution/fixture-minimal",
    "candidate_project_lock_digest": "sha256:12a52afb3f687e3e588bff48b77897ae9a50ae2737af139d84baefdf25203be9",
    "candidate_project_lock_ref": "aide://project-lock/fixture-minimal",
    "created_at": "fixture-timestamp:update-plan-v1",
    "created_by": "aide-self-hosting-fixture",
    "current_project_lock_digest": "sha256:12a52afb3f687e3e588bff48b77897ae9a50ae2737af139d84baefdf25203be9",
    "current_project_lock_ref": "aide://project-lock/fixture-minimal",
    "extensions": {},
    "ownership_ledger_digest": "sha256:de12996adcf9206fa838f5ec226b9974225a1b1eaf950d447bcc25a29d695e1a",
    "ownership_ledger_ref": "aide://ownership-ledger/fixture",
    "prior_update_plan_ref": null,
    "superseded_by_ref": null,
    "target_project_identity": "fixture/project",
    "target_project_ref": "aide://project/fixture",
    "update_plan_ref": "aide://update-plan/aide-self-no-apply-update-plan-v1"
  },
  "schema_version": "aide.update-plan.v1",
  "spec": {
    "approval_requirements": [
      "independent UpdatePlan check",
      "acceptance gate",
      "future RollbackBundle acceptance before apply-engine work"
    ],
    "conflicts": [
      {
        "conflict_ref": "aide://update-plan/conflict/never-touch-git",
        "conflict_type": "never_touch_refusal",
        "disposition": "fail_closed_no_apply",
        "evidence_refs": [
          "aide://evidence/ownership-ledger-v1/source-projection"
        ],
        "extensions": {},
        "operation_ref": "aide://update-plan/operation/never-touch-git",
        "target_relative_path": ".git/**"
      },
      {
        "conflict_ref": "aide://update-plan/conflict/unknown-unclassified",
        "conflict_type": "manual_review_required",
        "disposition": "fail_closed_no_apply",
        "evidence_refs": [
          "aide://evidence/ownership-ledger-v1/source-projection"
        ],
        "extensions": {},
        "operation_ref": "aide://update-plan/operation/unknown-unclassified",
        "target_relative_path": "unclassified/**"
      }
    ],
    "evidence_refs": [
      "aide://evidence/update-plan-v1/source-projection"
    ],
    "explicit_non_capabilities": [
      "install_apply",
      "update_apply",
      "migration_apply",
      "repair_apply",
      "rollback_apply",
      "uninstall_apply",
      "target_repository_mutation",
      "target_scan_authority",
      "release_archive_creation",
      "release_publication",
      "git_tag_creation",
      "github_release_creation",
      "upload",
      "network_call",
      "provider_model_call",
      "workbench_runtime",
      "commander",
      "omnigent",
      "worker_execution",
      "preview_session_apply",
      "development_transaction_apply",
      "patch_transaction_apply",
      "branch_worktree_automation",
      "real_project_canary"
    ],
    "extensions": {},
    "install_record_digests": [
      "sha256:9c01b638175319a2c8fe5bcd8e3711b07ae49a1e6789da75ab3ddb9d63f79231"
    ],
    "install_record_refs": [
      "aide://install-record/minimal"
    ],
    "managed_file_updates": [
      {
        "evidence_refs": [
          "aide://evidence/ownership-ledger-v1/source-projection"
        ],
        "extensions": {},
        "manual_review_required": false,
        "operation_class": "update_managed_file",
        "operation_ref": "aide://update-plan/operation/vendor-file-project-lock-schema",
        "owner_ref": "aide://owner/aide-distribution",
        "ownership_class": "vendor_managed_file",
        "ownership_entry_ref": "aide://ownership-entry/vendor-file-project-lock-schema",
        "postimage_digest": "sha256:7e2c27b25ac5ca86f8ec2948c9982d831ea03f8a3d91ed854d298b80683d5a08",
        "preimage_digest": "sha256:7e2c27b25ac5ca86f8ec2948c9982d831ea03f8a3d91ed854d298b80683d5a08",
        "rollback_requirement_ref": "aide://rollback-requirement/update-plan-v1/preimage-required",
        "source_component_ref": "aide://component/aide-lite-core",
        "source_distribution_ref": "aide://distribution/fixture-minimal",
        "source_output_used_as_target_truth": false,
        "symlink_reparse_uncertain": false,
        "target_relative_path": ".aide/protocol/aide-project-lock-v0.schema.json",
        "target_repository_mutation_performed": false,
        "update_apply_implemented": false
      },
      {
        "evidence_refs": [
          "aide://evidence/ownership-ledger-v1/source-projection"
        ],
        "extensions": {},
        "manual_review_required": false,
        "operation_class": "update_managed_file",
        "operation_ref": "aide://update-plan/operation/vendor-file-aide-lite-cli",
        "owner_ref": "aide://owner/aide-distribution",
        "ownership_class": "vendor_managed_file",
        "ownership_entry_ref": "aide://ownership-entry/vendor-file-aide-lite-cli",
        "postimage_digest": "sha256:7e2c27b25ac5ca86f8ec2948c9982d831ea03f8a3d91ed854d298b80683d5a08",
        "preimage_digest": "sha256:7e2c27b25ac5ca86f8ec2948c9982d831ea03f8a3d91ed854d298b80683d5a08",
        "rollback_requirement_ref": "aide://rollback-requirement/update-plan-v1/preimage-required",
        "source_component_ref": "aide://component/aide-lite-core",
        "source_distribution_ref": "aide://distribution/fixture-minimal",
        "source_output_used_as_target_truth": false,
        "symlink_reparse_uncertain": false,
        "target_relative_path": ".aide/scripts/aide_lite.py",
        "target_repository_mutation_performed": false,
        "update_apply_implemented": false
      }
    ],
    "managed_section_updates": [
      {
        "evidence_refs": [
          "aide://evidence/ownership-ledger-v1/source-projection"
        ],
        "extensions": {},
        "manual_review_required": false,
        "operation_class": "update_managed_section",
        "operation_ref": "aide://update-plan/operation/vendor-section-agents-summary",
        "owner_ref": "aide://owner/aide-distribution",
        "ownership_class": "vendor_managed_section",
        "ownership_entry_ref": "aide://ownership-entry/vendor-section-agents-summary",
        "postimage_digest": "sha256:7e2c27b25ac5ca86f8ec2948c9982d831ea03f8a3d91ed854d298b80683d5a08",
        "preimage_digest": "sha256:7e2c27b25ac5ca86f8ec2948c9982d831ea03f8a3d91ed854d298b80683d5a08",
        "rollback_requirement_ref": "aide://rollback-requirement/update-plan-v1/preimage-required",
        "source_component_ref": "aide://component/aide-lite-core",
        "source_distribution_ref": "aide://distribution/fixture-minimal",
        "source_output_used_as_target_truth": false,
        "symlink_reparse_uncertain": false,
        "target_relative_path": "AGENTS.md",
        "target_repository_mutation_performed": false,
        "update_apply_implemented": false
      }
    ],
    "manual_review_items": [
      {
        "extensions": {},
        "item_ref": "aide://update-plan/conflict/unknown-unclassified",
        "reason": "manual_review_required",
        "required": true
      }
    ],
    "migration_record_digests": [
      "sha256:7a5b442d934130c5b28db32d03ca22099ca54fa8c2d3a4740deeb7e26d2eac96"
    ],
    "migration_record_refs": [
      "aide://migration-record/minimal",
      "aide://migration-record/future-accepted-no-apply"
    ],
    "optional_features": [
      "conflict_only_plan_v1",
      "project_overlay_preservation_v1"
    ],
    "planned_operations": [
      {
        "evidence_refs": [
          "aide://evidence/ownership-ledger-v1/source-projection"
        ],
        "extensions": {},
        "manual_review_required": false,
        "operation_class": "preserve_runtime_generated",
        "operation_ref": "aide://update-plan/operation/runtime-generated-local-state",
        "owner_ref": "aide://owner/local-runtime",
        "ownership_class": "runtime_generated",
        "ownership_entry_ref": "aide://ownership-entry/runtime-generated-local-state",
        "postimage_digest": "",
        "preimage_digest": "",
        "rollback_requirement_ref": "aide://rollback-requirement/update-plan-v1/preimage-required",
        "source_component_ref": null,
        "source_distribution_ref": "aide://distribution/fixture-minimal",
        "source_output_used_as_target_truth": false,
        "symlink_reparse_uncertain": false,
        "target_relative_path": ".aide.local/**",
        "target_repository_mutation_performed": false,
        "update_apply_implemented": false
      },
      {
        "evidence_refs": [
          "aide://evidence/ownership-ledger-v1/source-projection"
        ],
        "extensions": {},
        "manual_review_required": false,
        "operation_class": "regenerate_project_output",
        "operation_ref": "aide://update-plan/operation/project-generated-context",
        "owner_ref": "aide://owner/target-project",
        "ownership_class": "project_generated",
        "ownership_entry_ref": "aide://ownership-entry/project-generated-context",
        "postimage_digest": "",
        "preimage_digest": "",
        "rollback_requirement_ref": "aide://rollback-requirement/update-plan-v1/preimage-required",
        "source_component_ref": null,
        "source_distribution_ref": "aide://distribution/fixture-minimal",
        "source_output_used_as_target_truth": false,
        "symlink_reparse_uncertain": false,
        "target_relative_path": ".aide/context/generated/context-pack.json",
        "target_repository_mutation_performed": false,
        "update_apply_implemented": false
      },
      {
        "evidence_refs": [
          "aide://evidence/ownership-ledger-v1/source-projection"
        ],
        "extensions": {},
        "manual_review_required": false,
        "operation_class": "preserve_legacy",